<?xml version="1.0" encoding="UTF-8"?>
<xsd:schema xmlns:xsd="http://www.w3.org/2001/XMLSchema" xmlns:od="urn:schemas-microsoft-com:officedata">
<xsd:element name="dataroot">
<xsd:complexType>
<xsd:sequence>
<xsd:element ref="unit_stats_naval_experience_bonuses" minOccurs="0" maxOccurs="unbounded"/>
</xsd:sequence>
<xsd:attribute name="generated" type="xsd:dateTime"/>
</xsd:complexType>
</xsd:element>
<xsd:element name="unit_stats_naval_experience_bonuses">
<xsd:annotation>
<xsd:appinfo>
<od:index index-name="PrimaryKey" index-key="xp_level " primary="yes" unique="yes" clustered="no"/>
<od:index index-name="s_GUID" index-key="s_GUID " primary="no" unique="yes" clustered="no"/>
<od:index index-name="s_Generation" index-key="s_Generation " primary="no" unique="no" clustered="no"/>
</xsd:appinfo>
</xsd:annotation>
<xsd:complexType>
<xsd:sequence>
<xsd:element name="xp_level" minOccurs="0" od:jetType="integer" od:sqlSType="smallint" type="xsd:short"/>
<xsd:element name="melee_defence" minOccurs="0" od:jetType="integer" od:sqlSType="smallint" type="xsd:short"/>
<xsd:element name="core_gunner_loading_skill" minOccurs="0" od:jetType="integer" od:sqlSType="smallint" type="xsd:short"/>
<xsd:element name="core_gunner_marksmanship" minOccurs="0" od:jetType="integer" od:sqlSType="smallint" type="xsd:short"/>
<xsd:element name="morale" minOccurs="0" od:jetType="integer" od:sqlSType="smallint" type="xsd:short"/>
<xsd:element name="mp_fixed_cost" minOccurs="0" od:jetType="double" od:sqlSType="float" type="xsd:double"/>
<xsd:element name="mp_experience_cost_multiplier" minOccurs="0" od:jetType="double" od:sqlSType="float" type="xsd:double"/>
<xsd:element name="s_ColLineage" minOccurs="0" od:jetType="oleobject" od:sqlSType="image">
<xsd:simpleType>
<xsd:restriction base="xsd:base64Binary">
<xsd:maxLength value="1476395008"/>
</xsd:restriction>
</xsd:simpleType>
</xsd:element>
<xsd:element name="s_Generation" minOccurs="0" od:jetType="longinteger" od:sqlSType="int" type="xsd:int"/>
<xsd:element name="s_GUID" minOccurs="0" od:jetType="replicationid" od:sqlSType="uniqueidentifier" od:autoUnique="yes">
<xsd:simpleType>
<xsd:restriction base="xsd:string">
<xsd:maxLength value="38"/>
</xsd:restriction>
</xsd:simpleType>
</xsd:element>
<xsd:element name="s_Lineage" minOccurs="0" od:jetType="oleobject" od:sqlSType="image">
<xsd:simpleType>
<xsd:restriction base="xsd:base64Binary">
<xsd:maxLength value="1476395008"/>
</xsd:restriction>
</xsd:simpleType>
</xsd:element>
</xsd:sequence>
</xsd:complexType>
</xsd:element>
</xsd:schema>
